{
  "schema_version": "0.1",
  "executor_id": "auditor-executor",
  "role": "AUDITOR",
  "authority": "INDEPENDENT_AUDIT",
  "audit_result": "PASS",
  "audited_sha": "aaaaaaaaaaaaaaaaaaaaaaaaaaaaaaaaaaaaaaaa",
  "summary": "Independent review complete.",
  "findings": [],
  "checks": [{"id": "scope", "status": "PASS", "evidence": {"evidence_id": "audit-scope", "sha256": "bbbbbbbbbbbbbbbbbbbbbbbbbbbbbbbbbbbbbbbbbbbbbbbbbbbbbbbbbbbbbbbb"}}],
  "residual_risks": [],
  "gate_registration": "NOT_AUTHORIZED"
}
